{"activated_at":"2026-08-28T05:46:36Z","activation_cohort_id":"identity-calendar-coordinated-activation-20260828T1446KST","activation_reason":"Coordinated cohort rebinding of the unchanged verified Instrument Identity for the approved Session Calendar refresh.","activation_reason_code":"INITIAL_BOOTSTRAP","activation_schema_version":"1.0","activation_status":"ACTIVE","active_registry_hash":"502148a4fd4fa9f4b06365f0b02c630839315c79c8bfddcfac4addf7519261d6","active_registry_version":"2026-08-22.1","authority_as_of":"2026-08-22T00:00:00+09:00","authority_id":"US_EQUITY_INSTRUMENT_IDENTITY_CURRENT_V1","authority_modes_allowed":["CURRENT"],"scope":["BE","DRAM","FSLY","MVLL","NBIS","NOW","SOXL","TOST"],"source_packet_hash":"7094b487cc08a191601874fb92e426d99973bcbd8f6ae574b16e80e4eb16f27e","source_packet_id":"US_EQUITY_INSTRUMENT_IDENTITY_CURRENT_V1_SOURCES_2026-08-22","ticker_namespace":"US_EXCHANGE_LISTED"}
